outs/exercise_05/classification_metrics_200_epochs.csv

,precision,recall,f1-score,support
airplane,0.6653620352250489,0.68,0.6726013847675568,1000.0
automobile,0.7326633165829146,0.729,0.7308270676691729,1000.0
bird,0.5493975903614458,0.456,0.49836065573770494,1000.0
cat,0.4524793388429752,0.438,0.4451219512195122,1000.0
deer,0.547808764940239,0.55,0.5489021956087824,1000.0
dog,0.5652173913043478,0.52,0.5416666666666666,1000.0
frog,0.6402164111812444,0.71,0.6733048838311996,1000.0
horse,0.6849056603773584,0.726,0.7048543689320388,1000.0
ship,0.7325349301397206,0.734,0.7332667332667333,1000.0
truck,0.6440366972477064,0.702,0.6717703349282297,1000.0
accuracy,0.6245,0.6245,0.6245,0.6245
macro avg,0.6214622136203001,0.6245,0.6220676242627597,10000.0
weighted avg,0.6214622136203001,0.6245,0.6220676242627596,10000.0

src/exercise_05/readme_exercise.md

### Discussion of the training process

A partir de la época 75-80, las curvas se vuelven completamente planas. El Accuracy de validación oscila en una franja muy estrecha entre el 61% y el 62.5%.

### Evaluation results

Tras 200 épocas, el modelo alcanzó un Overall Accuracy del 62.45% (6245 aciertos sobre 10000 en el test set).

##### How the model solves the problem?

* La precisión máxima ha subido apenas un ~1% respecto a las 60 épocas. Esto confirma que el límite de una red densa en CIFAR-10 ronda los sesentas. Al aplanar la imagen (3072 dimensiones), se destruye la jerarquía espacial, obligando al modelo a memorizar distribuciones globales de intensidad y color.
* **Clases mejor reconocidas:**  `ship` (F1: 0.733),  `automobile` (F1: 0.731) y `horse` (0.705). Esto puede deberse a que dichas imagenes cuentan con fondos o colores muy distintivos (azul para barcos, asfalto gris para autos).
* **Clases peor reconocidas:** `cat` (F1: 0.445), `bird` (F1: 0.498), `dog` (F1: 0.542).
* **Patrones de confusión críticos:** La matriz de confusión de 200 épocas muestra que el modelo no percibe bien la diferencia entre gatos y perros (predijo perro cuando era gato 196 veces, y predijo gato cuando era perro 181 veces). También confunde mucho aves con ciervos (136 veces) y aves con ranas (92 veces). Al no contar con filtros convolucionales le impide detectar caracteristicas más complejas y definidas como "orejas", "picos" o "ruedas"; solo ve matrices de píxeles.

### Does the model generalizes well to new data?

Al comparar la tabla de F1-scores de este modelo (donde el gato tiene un valor tan bajo como 0.445) con la teoría que estudiamos sobre Redes Neuronales Convolucionales y la F1-scores del CNN del ejercicio 4, la transición es obligatoria. El MLP puede confundir camiones con automóviles porque ambos son "masas grises o metálicas sobre asfalto negro". En el modelo CNN pudimos usar pooling y filtros locales para buscar características espaciales.